{
  "$schema": "https://json-schema.org/draft/2020-12/schema",
  "$id": "quest.schema.json",
  "title": "Reval Rebel quest content",
  "type": "object",
  "additionalProperties": false,
  "required": [
    "type",
    "id",
    "title",
    "summary",
    "confidence",
    "canon_status",
    "approval",
    "entry_conditions",
    "initial_state",
    "states",
    "transitions",
    "objectives",
    "outcomes",
    "content_links",
    "source_notes"
  ],
  "properties": {
    "type": {
      "const": "quest"
    },
    "id": {
      "$ref": "common.schema.json#/$defs/content_id"
    },
    "title": {
      "type": "string",
      "minLength": 1
    },
    "summary": {
      "type": "string",
      "minLength": 1
    },
    "confidence": {
      "$ref": "common.schema.json#/$defs/confidence_label"
    },
    "canon_status": {
      "$ref": "common.schema.json#/$defs/canon_status"
    },
    "approval": {
      "$ref": "common.schema.json#/$defs/review_record"
    },
    "entry_conditions": {
      "type": "array",
      "items": {
        "$ref": "common.schema.json#/$defs/condition"
      }
    },
    "initial_state": {
      "$ref": "common.schema.json#/$defs/local_id"
    },
    "states": {
      "type": "array",
      "minItems": 1,
      "items": {
        "type": "object",
        "additionalProperties": false,
        "required": [
          "id",
          "label"
        ],
        "properties": {
          "id": {
            "$ref": "common.schema.json#/$defs/local_id"
          },
          "label": {
            "type": "string",
            "minLength": 1
          },
          "terminal": {
            "type": "boolean"
          }
        }
      }
    },
    "transitions": {
      "type": "array",
      "minItems": 1,
      "items": {
        "type": "object",
        "additionalProperties": false,
        "required": [
          "id",
          "from_state",
          "to_state",
          "effects"
        ],
        "properties": {
          "id": {
            "$ref": "common.schema.json#/$defs/local_id"
          },
          "from_state": {
            "$ref": "common.schema.json#/$defs/local_id"
          },
          "to_state": {
            "$ref": "common.schema.json#/$defs/local_id"
          },
          "conditions": {
            "type": "array",
            "items": {
              "$ref": "common.schema.json#/$defs/condition"
            }
          },
          "effects": {
            "type": "array",
            "items": {
              "$ref": "common.schema.json#/$defs/effect"
            }
          }
        }
      }
    },
    "objectives": {
      "type": "array",
      "minItems": 1,
      "items": {
        "type": "object",
        "additionalProperties": false,
        "required": [
          "id",
          "text",
          "state_id"
        ],
        "properties": {
          "id": {
            "$ref": "common.schema.json#/$defs/local_id"
          },
          "text": {
            "type": "string",
            "minLength": 1
          },
          "state_id": {
            "$ref": "common.schema.json#/$defs/local_id"
          },
          "conditions": {
            "type": "array",
            "items": {
              "$ref": "common.schema.json#/$defs/condition"
            }
          }
        }
      }
    },
    "journal_evidence": {
      "type": "array",
      "items": {
        "type": "object",
        "additionalProperties": false,
        "required": [
          "fact_id",
          "text"
        ],
        "properties": {
          "fact_id": {
            "$ref": "common.schema.json#/$defs/content_id"
          },
          "text": {
            "type": "string",
            "minLength": 1
          }
        }
      }
    },
    "investigation": {
      "type": "object",
      "additionalProperties": false,
      "required": [
        "suspects",
        "culprit_id",
        "min_clues_for_full_resolution",
        "clues"
      ],
      "properties": {
        "suspects": {
          "type": "array",
          "minItems": 1,
          "items": {
            "$ref": "common.schema.json#/$defs/content_id"
          }
        },
        "culprit_id": {
          "$ref": "common.schema.json#/$defs/content_id"
        },
        "min_clues_for_full_resolution": {
          "type": "integer",
          "minimum": 1
        },
        "clues": {
          "type": "array",
          "minItems": 1,
          "items": {
            "type": "object",
            "additionalProperties": false,
            "required": [
              "fact_id"
            ],
            "properties": {
              "fact_id": {
                "$ref": "common.schema.json#/$defs/content_id"
              },
              "exonerates": {
                "type": "array",
                "items": {
                  "$ref": "common.schema.json#/$defs/content_id"
                }
              }
            }
          }
        }
      }
    },
    "outcomes": {
      "type": "array",
      "minItems": 1,
      "items": {
        "type": "object",
        "additionalProperties": false,
        "required": [
          "id",
          "summary",
          "effects"
        ],
        "properties": {
          "id": {
            "$ref": "common.schema.json#/$defs/local_id"
          },
          "summary": {
            "type": "string",
            "minLength": 1
          },
          "effects": {
            "type": "array",
            "items": {
              "$ref": "common.schema.json#/$defs/effect"
            }
          }
        }
      }
    },
    "content_links": {
      "type": "object",
      "additionalProperties": false,
      "properties": {
        "character_ids": {
          "type": "array",
          "items": {
            "$ref": "common.schema.json#/$defs/content_id"
          }
        },
        "dialogue_ids": {
          "type": "array",
          "items": {
            "$ref": "common.schema.json#/$defs/content_id"
          }
        },
        "bark_ids": {
          "type": "array",
          "items": {
            "$ref": "common.schema.json#/$defs/content_id"
          }
        },
        "commission_ids": {
          "type": "array",
          "items": {
            "$ref": "common.schema.json#/$defs/content_id"
          }
        },
        "item_ids": {
          "type": "array",
          "items": {
            "$ref": "common.schema.json#/$defs/content_id"
          }
        },
        "location_ids": {
          "type": "array",
          "items": {
            "$ref": "common.schema.json#/$defs/content_id"
          }
        }
      }
    },
    "source_notes": {
      "type": "array",
      "minItems": 1,
      "items": {
        "$ref": "common.schema.json#/$defs/source_note"
      }
    }
  }
}
