{
  "type": "quest",
  "id": "quest.act2.night.defense",
  "title": "Hold the Barracks Door",
  "summary": "Keep a night breach from reaching the barracks, choosing a stand-up defense or a quiet diversion.",
  "confidence": "invented",
  "canon_status": "draft",
  "approval": {
    "status": "draft",
    "reviewer": "P5-004",
    "notes": "Content-only Act 2 night defense template; runtime mission host remains downstream work."
  },
  "entry_conditions": [],
  "initial_state": "latent",
  "states": [
    {
      "id": "latent",
      "label": "Waiting for the defense brief"
    },
    {
      "id": "ready",
      "label": "At the barracks door"
    },
    {
      "id": "combat_complete",
      "label": "Barracks held after a fight",
      "terminal": true
    },
    {
      "id": "non_combat_complete",
      "label": "Barracks held without a fight",
      "terminal": true
    }
  ],
  "transitions": [
    {
      "id": "brief",
      "from_state": "latent",
      "to_state": "ready",
      "effects": [
        {
          "op": "set_flag",
          "key": "flag.act2.night.defense.briefed",
          "value": true
        }
      ]
    },
    {
      "id": "resolve_combat",
      "from_state": "ready",
      "to_state": "combat_complete",
      "effects": [
        {
          "op": "set_flag",
          "key": "flag.act2.night.defense.combat_resolved",
          "value": true
        },
        {
          "op": "record_faction_event",
          "key": "ledger.act2.night.defense.combat",
          "value": "faction.livonian_order",
          "amount": 1,
          "summary": "Kalev held the barracks door while the watch rallied behind him."
        }
      ]
    },
    {
      "id": "resolve_non_combat",
      "from_state": "ready",
      "to_state": "non_combat_complete",
      "effects": [
        {
          "op": "set_flag",
          "key": "flag.act2.night.defense.non_combat_resolved",
          "value": true
        },
        {
          "op": "record_faction_event",
          "key": "ledger.act2.night.defense.non_combat",
          "value": "faction.black_cloaks",
          "amount": 1,
          "summary": "Kalev diverted the breach away from the barracks without drawing steel."
        }
      ]
    }
  ],
  "objectives": [
    {
      "id": "reach_barracks",
      "text": "Reach the Viru barracks when the night alarm sounds.",
      "state_id": "latent"
    },
    {
      "id": "hold_door",
      "text": "Hold the barracks by fighting or by diverting the breach.",
      "state_id": "ready"
    }
  ],
  "outcomes": [
    {
      "id": "combat",
      "summary": "The barracks door holds after a direct defense.",
      "effects": []
    },
    {
      "id": "non_combat",
      "summary": "The breach is diverted before a fight reaches the barracks.",
      "effects": []
    }
  ],
  "content_links": {
    "character_ids": [
      "char.henning",
      "char.kaja"
    ],
    "location_ids": [
      "loc.lower_town_slice"
    ]
  },
  "source_notes": [
    {
      "confidence": "invented",
      "summary": "P5-004 template contract; local route framing is authored while the Act 2 siege phase remains the P5-001 design spine.",
      "citations": [
        "docs/reports/p5_001_act2_design.md",
        "docs/GAMEPLAY-NIGHT.md"
      ]
    }
  ]
}
